Query,Tab Complete,Regex Matches,Exact and Fuzzy Matches,Total Matches,Combined Search Time (ms),Merging Time (ms),Total Runtime (ms),,Result 1,Result 2,Result 3,Result 4,Result 5,Result 6,Result 7,Result 8,Result 9,Result 10,Result 11,Result 12,Result 13,Result 14,Result 15
aven,Avenue Montaigne,5,10,15,111.594611,0.269885,112.663541,,Avenue Montaigne,Avenged,Avengers: Age of Ultron,Avenged,Avengers Confidential: Black Widow & Punisher,The Toxic Avenger Part II,Ultimate Avengers II,The Toxic Avenger Part III: The Last Temptation of Toxie,Citizen Toxie: The Toxic Avenger IV,The Avengers,Ultimate Avengers,The Avengers,Blue Hill Avenue,It Happened on Fifth Avenue,The Prisoner of Second Avenue
The Mattrix,,0,15,15,215.408624,0.2138,216.537403,,The Matrix Reloaded,The Matrix Revolutions,The Matrix,The Mattei Affair,The Matrimony,The Matriarch,George Harrison: Living in the Material World,The Mating Season,The Mating Game,The Matchmaker,The Matador,The Matador,The Matchmaker,The Mating of Millie,The Match Factory Girl
Jurrasic Par,,0,15,15,108.431235,0.054898,108.62806,,Jurassic Park III,Jurassic Park III,Jurassic Park,Parasyte: Part 1,The Lost World: Jurassic Park,Paranoid Park,Pardon Mon Affaire,Paris Is Burning,"Paris, je t'aime",Paranormal Activity 2,Paranormal Activity 3,Paranormal Activity 4,Paris Belongs to Us,"Pardon Mon Affaire, Too!",The Park Is Mine
Titannic,,0,12,12,103.923003,0.034042,104.086673,,Raise the Titanic,Titanica,Titanic,Titanic,Titanic Town,The Chambermaid on the Titanic,The Ten Lives of Titanic the Cat,Clash of the Titans,Titan A.E.,Remember the Titans,Clash of the Titans,Wrath of the Titans,,,
The Godfathe,The Godfather,3,12,15,106.732332,0.097126,106.923726,,The Godfather,The Godfather: Part II,The Godfather: Part III,The Goddess,The Goddess,The Godsend,The Goddess,The Goddess of 1967,As the Gods Will,The Food of the Gods,The God of Cookery,The Gods Must Be Crazy,The Gods Must Be Crazy II,Hammer of the Gods,Stargate SG-1: Children of the Gods - Final Cut
Forrest Gump,Forrest Gump,1,14,15,97.635048,0.06276,97.807615,,Forrest Gump,Finding Forrester,Days and Nights in the Forest,Gumshoe,The Emerald Forest,Legend of the Forest,Grumpy Old Men,Once Upon a Forest,Grumpier Old Men,Forest Warrior,Forest Warrior,Gupt: The Hidden Truth,Gummo,The Forest,Gumnaam
Star Wars: A New Hop,,0,15,15,113.223264,0.044564,113.355592,,Star Wars: Episode IV - A New Hope,Star Wars: The Clone Wars,Robot Chicken: Star Wars,Star Wars: Episode I - The Phantom Menace,Star Wars: Episode V - The Empire Strikes Back,Star Wars: Episode VI - Return of the Jedi,Star Wars: Episode III - Revenge of the Sith,Star Wars: Episode II - Attack of the Clones,Empire of Dreams: The Story of the 'Star Wars' Trilogy,A Star Is Born,A Star Is Born,A New Leaf,A New Life,A Five Star Life,Waco: A New Revelation
The Shawshank Redemptio,The Shawshank Redemption,2,13,15,114.559446,0.04702,114.701736,,The Shawshank Redemption,The Shawshank Redemption,Redemption: The Stan Tookie Williams Story,The Raid: Redemption,The Redemption of General Butt Naked,In the Shadow of the Moon,The Shaggy Dog,The Shaolin Temple,The Shaggy Dog,The Shadow,The Shaman,The Shape of Things,As the Shadow,In the Shadow,In the Shadow
Pul Fiction,,0,15,15,103.435604,0.038133,103.82024,,Pulp Fiction,Samurai Fiction,Real Fiction,Science Fiction,Stranger Than Fiction,Harry Dean Stanton: Partly Fiction,Pull My Daisy,Pull My Daisy,"Pulp: a Film About Life, Death & Supermarkets",Pulse,Pulse,Pulse,Pulsar,The Perils of Pauline,The Public Enemy
The Lord of the Rngs: The Felloship of the Rin,,0,15,15,106.528007,0.040826,106.872088,,The Lord of the Rings,The Lord of the Rings: The Fellowship of the Ring,The Lord of the Rings: The Return of the King,The Lord of the Rings: The Two Towers,Edges of the Lord,Ringers: Lord of the Fans,At Play in the Fields of the Lord,The Lords of Salem,Lord of the Flies,Something the Lord Made,"Greystoke: The Legend of Tarzan, Lord of the Apes",Phantasm III: Lord of the Dead,Lord of Illusions,Lord of War,Lord of Darkness
The Dark Knigt,,0,15,15,125.664535,0.062666,126.1957,,The Dark Knight,The Dark Knight Rises,The Dark,The Dark,The Dark Angel,The Dark Crystal,The Dark Backward,The Dark Half,The Dark Backward,The Dark Diamond,The Dark Diamond,The Dark Hours,The Dark House,The Dark Horse,After the Dark
Fight Clu,Fight Club,1,14,15,98.804301,0.055226,99.030563,,Fight Club,Street Fight,Girl Fight,Fight Back to School,Why We Fight,Fight for Your Right Revisited,Muhammad Ali's Greatest Fight,Escape Fire: The Fight to Rescue American Healthcare,Ip Man: The Final Fight,Fighter in the Wind,Fighter Pilot: Operation Red Flag,Foo Fighters: Back and Forth,The Fighting Lady,The Fighting Temptations,A Fighting Man
Incepcion,,0,2,2,96.173823,0.012326,96.342125,,Inception,Incendies,,,,,,,,,,,,,
The Lion Kin,The Lion King,4,11,15,103.111402,0.062803,103.285422,,The Lion King,The Lion King 2: Simba's Pride,The Lion King 1 1/2,The Lion King 1 1/2,The Lion in Winter,The Wind and the Lion,"The Chronicles of Narnia: The Lion, the Witch and the Wardrobe",The Lion's Mouth Opens,White Lion,Kin-dza-dza!,Next of Kin,Next of Kin,Next of Kin,Ku! Kin-dza-dza,Son of a Lion
Harry Potter and the Philosopher's Ston,,0,15,15,143.652813,0.016553,143.753364,,Harry Potter and the Sorcerer's Stone,Harry Potter and the Chamber of Secrets,Harry Potter and the Prisoner of Azkaban,Harry Potter and the Goblet of Fire,Harry Potter and the Half-Blood Prince,Harry Potter and the Order of the Phoenix,Harry Potter and the Deathly Hallows: Part 1,Harry Potter and the Deathly Hallows: Part 2,Harry and the Hendersons,Harry and Tonto,Tom Dick and Harry,Dumb and Dumberer: When Harry Met Lloyd,Harry & Son,Who Is Harry Nilsson (And Why Is Everybody Talkin' About Him?),Who Is Harry Nilsson (And Why Is Everybody Talkin' About Him?)
The Aveners,,0,15,15,98.468751,0.039679,98.57065,,The Avengers,The Avengers,The Age of the Earth,The Overcoat,The Verdict,The Event,The Aviator,The American,The Ape,The Aviators,The Overnighters,The Overnight,The Decline of the American Empire,The Vertical Ray of the Sun,Battle for the Planet of the Apes
Avatr,,0,15,15,118.893397,0.028475,118.982697,,Captain Alatriste: The Spanish Musketeer,Avatar,A Tree Grows in Brooklyn,Apartment for Peggy,Awaara,Strangers on a Train,A Streetcar Named Desire,Phone Call from a Stranger,The Actress,Not as a Stranger,Aparajito,Hèz a sziklèk alatt,The Little Apartment,The Apartment,Atraco a las tres
The Terminatr,,0,15,15,124.246289,0.059025,124.468205,,The Terminator,The Terminal,The Terminal,The Terror Live,The Terrorizers,The Terrorist,Terminator 3: Rise of the Machines,From the Terrace,Prison Terminal: The Last Days of Private Jack Hall,"Alexander and the Terrible, Horrible, No Good, Very Bad Day",Terminator 2: Judgment Day,Terminator Salvation,Terminator Genisys,Quarantine 2: Terminal,The More the Merrier
The Silens of the Lamb,,0,15,15,104.398153,0.03726,104.629546,,The Silence of the Lambs,The Wolf and the Lamb,Lamb,The Silences of the Palace,The Silences of the Palace,The Silence of Lorna,Year Zero: The Silent Death of Cambodia,Fantastic 4: Rise of the Silver Surfer,The Silent One,Breaking the Silence: Truth and Lies in the War on Terror,The Silence,The Silencers,The Silence,The Silence,The Silent World
Gladiatorr,,0,4,4,107.68451,0.010363,107.783745,,Gladiator,The Graduate,Graduation,Ghost Graduation,,,,,,,,,,,
The Prestig,The Prestige,1,14,15,99.876564,0.017993,99.959404,,The Prestige,The President,All the President's Men,The President's Last Bang,The Kidnapping of the President,The Hunting of the President,My Date with the President's Daughter,My Date with the President's Daughter,The Prefab People,The Preacher's Wife,The Preacher's Daughter,The Pretty One,The Preacher,The Preacher,The Presence
Interstelar,,0,15,15,104.891646,0.040371,105.057271,,Interstate 60: Episodes of the Road,Interstellar,Intersection,Interrupted Melody,Inherit the Wind,The Inheritance,Investigation of a Citizen Above Suspicion,The Inheritance,Interiors,Interrogation,Born in East L.A.,Innerspace,Intervista,Interdevochka,The Best Intentions
Goodfelas,,0,15,15,103.460017,0.03695,103.681556,,Goodfellas,The Good Earth,In the Good Old Summertime,"Good Evening, Mr. Wallenberg","Good Evening, Mr. Wallenberg",The Good Old Boys,A Good Lawyer's Wife,"Good Night, and Good Luck.",Good Luck Chuck,The Good Life,Good Ol' Boy,The Good Life,My Good Enemy,Good Ol' Freda,The Good Lie
The Green Mil,The Green Mile,1,14,15,164.780732,0.016459,164.888698,,The Green Mile,The Green,The Green Pastures,The Green Years,The Green Berets,The Green Wall,The Green Room,The Green Butchers,The Green Hornet,The Green Prince,The Green Inferno,Where the Green Ants Dream,The Capture of the Green River Killer,The Capture of the Green River Killer,The Scent of Green Papaya
The Departd,,0,15,15,199.312337,0.023349,199.405338,,The Departure,The Departed,The Dependent,The Depraved,The Deposit,"The World, the Flesh and the Devil",The Naked and the Dead,The Desert of the Tartars,The Quick and the Dead,The Living and the Dead,The Roses of the Desert,The House of the Devil,The Famous and the Dead,The Dead and the Living,The Deceased
Schindler's Lits,,0,15,15,150.258468,0.030997,150.362755,,Schindler's List,The Poor Little Rich Girl,Little Caesar,Three Little Pigs,Little Miss Marker,The Little Foxes,Little Women,Father's Little Dividend,The Little World of Don Camillo,"Come Back, Little Sheba",Little Boy Lost,The Little Kidnappers,God's Little Acre,The Little Apartment,David and Lisa
The Shinin,The Shining,1,14,15,194.242828,0.027433,194.375925,,The Shining,The Shipping News,And the Ship Sails On,Last Images of the Shipwreck,Shining Through,Shining Night: A Portrait of Composer Morten Lauridsen,A Bright Shining Lie,One Bright Shining Moment,The Sinking of the Laconia,The Singing Nun,The Singing Detective,Choppertown: The Sinners,The Fox & the Child,The Fox & the Child,The Son of the Sheik
Bravehar,,0,15,15,152.663423,0.034486,152.881685,,Braveheart,Home of the Brave,The Brave One,The Bravados,Lonely Are the Brave,Michael the Brave,The Brave,The Brave Little Toaster Goes to Mars,Michael the Brave,Battle of the Brave,Home of the Brave,The Brave One,Home of the Brave,Brave Story,Brave
The Sixth Sens,The Sixth Sense,1,14,15,209.463623,0.039869,209.56863,,The Sixth Sense,The Inn of the Sixth Happiness,The Sixties,The Sensation of Sight,The Six Million Dollar Man,The Five Senses,The Sisterhood of the Traveling Pants,The Sisterhood of the Traveling Pants 2,Sense and Sensibility,Sense & Sensibility,The Sisterhood of Night,A Sense of History,Ayn Rand: A Sense of Life,Ayn Rand: A Sense of Life,Tabu: A Story of the South Seas
The Usual Suspects,The Usual Suspects,1,14,15,116.7103,0.039587,116.796784,,The Usual Suspects,Business as Usual,The Suspect,The Suspect,The Suspect,Prime Suspect: The Lost Child,Prime Suspect 6: The Last Witness,Prime Suspect 7: The Final Act,Prime Suspect: Inner Circles,Prime Suspect 5: Errors of Judgement,Suspect X,Prime Suspect 2,Prime Suspect 3,The Suspended Step of the Stork,The Subject Was Roses
The Godfathe: Part II,,0,15,15,173.799902,0.013538,173.862379,,The Godfather: Part II,The Godfather: Part III,The Hangover Part II,The Toxic Avenger Part II,"The Karate Kid, Part II",The Last Exorcism Part II,Hostel: Part II,Gasland Part II,"That's Entertainment, Part II",Back to the Future Part II,Father of the Bride Part II,Rambo: First Blood Part II,The Gods Must Be Crazy II,The Godfather,The Hangover Part III
Saving Private Rya,Saving Private Ryan,1,14,15,111.752212,0.045424,111.847393,,Saving Private Ryan,Saving Grace,Saving Face,Saving God,Saving Face,Saving Christmas,Saving Sarah Cain,Saving Mr. Banks,Private,Private Romeo,Private Benjamin,Private Confessions,Private Parts,Private Lessons,Private Eye
Back to the Futur,Back to the Future,3,12,15,123.111139,0.046081,123.239266,,Back to the Future,Back to the Future Part II,Back to the Future Part III,Back to School,Back to Stay,Back to the USSR - takaisin Ryssiin,T-Rex: Back to the Cretaceous,Fight Back to School,Tremors 3: Back to Perfection,Before Flying Back to Earth,Before Flying Back to Earth,"Come Back to the 5 & Dime, Jimmy Dean, Jimmy Dean",A Mother's Courage: Talking Back to Autism,A Mother's Courage: Talking Back to Autism,Yes or No: Come Back to Me
The Truman Sho,The Truman Show,1,14,15,122.447577,0.040795,122.539956,,The Truman Show,The Trumpet of the Swan,"The Missing Piece: Mona Lisa, Her Thief, the True Story",Dark Prince: The True Story of Dracula,For Greater Glory: The True Story of Cristiada,The True Meaning of Christmas Specials,Ten Minutes Older: The Trumpet,The Truth,The Truce,The Truth About Jane,The Truth About Charlie,Where the Truth Lies,Where the Truth Lies,The Trouble with the Truth,The Truth About Cats & Dogs
The Social Netwrk,,0,15,15,96.685492,0.014111,96.769924,,The Social Network,#chicagoGirl: The Social Network Takes on a Dictator,The Cheyenne Social Club,Social Genocide,Buena Vista Social Club,A Very Social Secretary,The Scalphunters,Socialphobia,The Sicilian Clan,The Sicilian Girl,The Source: The Story of the Beats and the Beat Generation,"Jimmy Rosenberg: The Father, the Son & the Talent",The Son of the Sheik,The Sorrow and the Pity,The Day of the Locust
The_Matrix,,0,15,15,108.718165,0.036041,108.800917,,The Mating of Millie,The Mating Season,The Matchmaker,The Mating Game,The Mattei Affair,The Match Factory Girl,The Matrix,Beyond the Mat,The Matrix Reloaded,The Matrix Revolutions,The Matthew Shepard Story,The Matador,The Matrimony,The Matriarch,George Harrison: Living in the Material World
Th Mtrix,,0,15,15,107.912149,0.214551,109.051389,,The Matrix,The Matrix Reloaded,The Matrix Revolutions,The Trials of Oscar Wilde,"Muriel, or The Time of Return",The Trial,The Trial of Joan of Arc,The Effect of Gamma Rays on Man-in-the-Moon Marigolds,The Triple Echo,The Marriage of Maria Braun,From the Life of the Marionettes,The Trip to Bountiful,The Trio,Marie from the Bay of Angels,The Year of Maria
Jrassic Park,,0,15,15,111.563269,0.056434,111.712257,,Jurassic Park,Jurassic Park III,Jurassic Park III,Gorky Park,Dog Park,Mansfield Park,Gosford Park,Wicker Park,Paranoid Park,Mansfield Park,Blowfly Park,Pervert Park,Trailer Park Jesus,Broken Glass Park,The Park Is Mine
Ttanik,,0,15,15,110.255961,0.056482,110.410346,,Thank God It's Friday,Raise the Titanic,Tank,Titanica,"To Wong Foo Thanks for Everything, Julie Newmar",Titanic,Thank God He Met Lizzie,Titanic,Titanic Town,The Chambermaid on the Titanic,Thanksgiving Family Reunion,Thank You for Smoking,The Ten Lives of Titanic the Cat,Thank You,Thanks for Sharing
The Gdfather,,0,15,15,98.886462,0.04675,99.026203,,The Godfather,The Gathering,The Gift,The Gathering Storm,The Godfather: Part II,The Godfather: Part III,Exit Through the Gift Shop,"The Good, the Bad, the Weird",Pure Country 2: The Gift,The Fox & the Child,The Fox & the Child,The Dish & the Spoon,"The World, the Flesh and the Devil",The Lord of the Rings: The Fellowship of the Ring,The Hobbit: The Battle of the Five Armies
Frst Gmp,,0,15,15,114.295605,0.049453,114.482823,,The First Grader,First Monday in October,Pokèmon: The First Movie - Mewtwo Strikes Back,My First Mister,Pokèmon: The First Movie - Mewtwo Strikes Back,Angels in Fast Motion,To Get to Heaven First You Have to Die,The First Man,Green Lantern: First Flight,I Give My First Love to You,The First Movie,Olympia Part One: Festival of the Nations,Olympia Part Two: Festival of Beauty,His Girl Friday,The Forty-first
Str Wrs,,0,15,15,95.070839,0.033893,95.216904,,Star Wars: Episode V - The Empire Strikes Back,The Strength of Water,The Street with No Name,Walking the Streets of Moscow,When a Stranger Calls Back,Wall Street: Money Never Sleeps,"Above the Street, Below the Water",The Strange Case of Wilhelm Reich,Strawberry Wine,The White Stripes Under Great White Northern Lights,"The Other One: The Long, Strange Trip of Bob Weir",When a Stranger Calls,When a Stranger Calls,One Piece: Strong World,Resurrecting the Street Walker
Th Shwshnk Rdemptn,,0,15,15,115.919891,0.036563,116.080726,,The Shawshank Redemption,The Shawshank Redemption,Road to Redemption,Redemption: The Stan Tookie Williams Story,The Redemption of General Butt Naked,The Raid: Redemption,The Great Train Robbery,"Winsor McCay, the Famous Cartoonist of the N.Y. Herald and His Moving Comics",Gertie the Dinosaur,In the Land of the Head Hunters,The Perils of Pauline,The Italian,The Poor Little Rich Girl,The Blue Bird,From Hand to Mouth
Pulp Fcton,,0,15,15,107.097154,0.037276,107.254582,,Pulp Fiction,"Pulp: a Film About Life, Death & Supermarkets",Pull My Daisy,Pull My Daisy,Purple Noon,The Pumpkin Eater,"It's the Great Pumpkin, Charlie Brown",Pumping Iron,The Purple Taxi,Purple Rain,The Color Purple,The Purple Rose of Cairo,Pumpkinhead,Puppetmaster,Puppet Master II
The Lord f the Rngs: The Flwshp f the Ring,,0,15,15,113.12798,0.03455,113.347172,,The Lord of the Rings: The Fellowship of the Ring,Christiane F.,F/X,The Lord of the Rings,The Lord of the Rings: The Two Towers,The Lord of the Rings: The Return of the King,F for Fake,Who the F**K Is Arthur Fogel,Something the Lord Made,Ringers: Lord of the Fans,Edges of the Lord,The Ring,The Ring Two,The Ring Finger,At Play in the Fields of the Lord
Th Drk Knght,,0,15,15,135.720781,0.014481,135.906808,,The Dark Knight,The Dark Knight Rises,"Batman: The Dark Knight Returns, Part 2","Batman: The Dark Knight Returns, Part 1",Tales from the Crypt: Demon Knight,The Dark Angel,Dreams That Money Can Buy,Knights of the Round Table,The Dark at the Top of the Stairs,"The 1,000 Eyes of Dr. Mabuse",Dr. Strangelove or: How I Learned to Stop Worrying and Love the Bomb,A Shot in the Dark,Dark of the Sun,The Abominable Dr. Phibes,The Way of the Dragon
Fight Clb,,0,15,15,105.867872,0.038918,106.04268,,Fight Club,Street Fight,Girl Fight,Fight Back to School,Why We Fight,Fight for Your Right Revisited,Muhammad Ali's Greatest Fight,Escape Fire: The Fight to Rescue American Healthcare,Ip Man: The Final Fight,Fighter in the Wind,Fighter Pilot: Operation Red Flag,Foo Fighters: Back and Forth,The Fighting Lady,The Fighting Temptations,A Fighting Man
Incptn,,0,6,6,100.86293,0.019817,101.022033,,Pretty in Pink,Maledetto il giorno che t'ho incontrato,An Inconvenient Truth,Oscar and the Lady in Pink,Incendies,Inception,,,,,,,,,
Th Ln Kng,,0,15,15,96.32084,0.037255,96.493885,,The Line King: The Al Hirschfeld Story,The White Haired Witch of Lunar Kingdom,The Lion King,The Last of the High Kings,The Long Kiss Goodnight,The Lion King 2: Simba's Pride,The Lord of the Rings: The Return of the King,The Lion King 1 1/2,The Lion King 1 1/2,The Librarian: Return to King Solomon's Mines,The Last King of Scotland,The Killing of John Lennon,I Know a Woman Like That,"Chris Rock: Kill the Messenger - London, New York, Johannesburg",In the Land of the Head Hunters
Hrry Pott and th Philospher's Stne,,0,15,15,114.342344,0.034289,114.476848,,Harry Potter and the Sorcerer's Stone,Harry Potter and the Chamber of Secrets,Harry Potter and the Prisoner of Azkaban,Harry Potter and the Goblet of Fire,Harry Potter and the Half-Blood Prince,Harry Potter and the Order of the Phoenix,Harry Potter and the Deathly Hallows: Part 1,Harry Potter and the Deathly Hallows: Part 2,Harry and the Hendersons,Strange Powers: Stephin Merritt and the Magnetic Fields,Shun Li and the Poet,Harry and Tonto,Here and There,Monty Python and the Holy Grail,Slappy and the Stinkers
The Avenrs,,0,15,15,153.9465,0.014499,154.019696,,The Avengers,The Avengers,The Age of the Earth,The Adversary,The Adversary,The Overcoat,The Verdict,The Event,The Aviator,The American,The Ape,The Aviators,The Overnighters,The Overnight,The Decline of the American Empire
Avtar,,0,15,15,112.916087,0.035185,113.018047,,Antarctica,The Dangerous Lives of Altar Boys,Shackleton's Antarctic Adventure,Antares,Antarctic Journal,Avatar,Antarctica: A Year on Ice,Meshes of the Afternoon,A Tree Grows in Brooklyn,I See a Dark Stranger,Apartment for Peggy,Awaara,Strangers on a Train,The Actress,A Star Is Born
Th Termnator,,0,15,15,92.456832,0.022944,92.656488,,The Terminator,The Terminal,The Terminal,Coming to Terms,From the Terrace,Indiana Jones and the Temple of Doom,The Terrorizers,The Temp,The Temptations,Terminator 3: Rise of the Machines,The Terrorist,Bridge to Terabithia,The Temptation of St. Tony,The Tempest,Almanya: Welcome to Germany
Th Slnc f the Lmbs,,0,15,15,110.415335,0.018495,110.562136,,Christiane F.,F/X,Who the F**K Is Arthur Fogel,F for Fake,The Silence of the Lambs,The Sunchaser,The Lobster,The Last Sunset,The Lost Son,The Last Song,The Last Sentence,The Children of Sanchez,Breaking the Silence: Truth and Lies in the War on Terror,Ever Since the World Ended,The Fog of War: Eleven Lessons from the Life of Robert S. McNamara
Gladiatr,,0,4,4,96.858924,0.013645,96.967345,,Gladiator,The Graduate,Graduation,Ghost Graduation,,,,,,,,,,,
Th Prstge,,0,15,15,92.074681,0.016899,92.146634,,Thirst,Thirst,Thirst,The Thirsting,Thirst,Lost Boys: The Thirst,Drew: The Man Behind the Poster,A Thirsty World,The Great Train Robbery,"Winsor McCay, the Famous Cartoonist of the N.Y. Herald and His Moving Comics",Gertie the Dinosaur,In the Land of the Head Hunters,The Perils of Pauline,The Italian,The Poor Little Rich Girl
Intrstelar,,0,9,9,96.502982,0.033852,96.650894,,Intruder in the Dust,Intruders,Intersection,Interstate 60: Episodes of the Road,The Intruder,The Intruder,Interstellar,Intruders,Hamilton: I nationens intresse,,,,,,
Gdfllas,,0,0,0,94.353977,0.0005969999993,94.464651,,,,,,,,,,,,,,,,
Th Grn Mle,,0,15,15,94.163668,0.014505,94.238441,,The Green Mile,3000 Miles to Graceland,Take Me Out to the Ball Game,The Great Manhunt,The Grand Maneuver,The Grand Maneuver,The Great Man,The Man in the Gray Flannel Suit,The Great Northfield Minnesota Raid,The Man with the Golden Gun,Monty Python and the Holy Grail,God Told Me To,The Great Muppet Caper,The Great Mouse Detective,Maledetto il giorno che t'ho incontrato
The Depardd,,0,15,15,206.144547,0.012457,206.212098,,The Departure,The Departed,The Dependent,The Depraved,The Deposit,"The World, the Flesh and the Devil",The Naked and the Dead,The Desert of the Tartars,The Quick and the Dead,The Living and the Dead,The Roses of the Desert,The House of the Devil,The Famous and the Dead,The Dead and the Living,The Deceased
Schindlr's Lst,,0,15,15,120.952186,0.030721,121.037073,,Schindler's List,The Poor Little Rich Girl,Little Caesar,Three Little Pigs,Little Miss Marker,The Lost Patrol,The Letter,The Little Foxes,The Last Chance,Let There Be Light,Lost Youth,Little Women,Lost Boundaries,Das doppelte Lottchen,Father's Little Dividend
Th Shinng,,0,15,15,154.901942,0.013574,154.987534,,The Shining,Sex and the Single Girl,The Singing Nun,Shining Through,The Singing Detective,The Singer (Quand j'ètais chanteur),Choppertown: The Sinners,The Single Moms Club,"To Singapore, with Love",The Sin of Madelon Claudet,The Sin of Harold Diddlebock,Singin' in the Rain,The Sun Shines Bright,Lady Sings the Blues,The Sting
Brveheart,,0,1,1,92.221489,0.014774,92.405545,,Braveheart,,,,,,,,,,,,,,
Th Sxth Sene,,0,15,15,113.181534,0.023802,113.26881,,The Sixth Sense,Scenes from the Class Struggle in Beverly Hills,The Sensation of Sight,Tabu: A Story of the South Seas,The Barretts of Wimpole Street,Snow White and the Seven Dwarfs,The Seventh Victim,The House on 92nd Street,The Seventh Veil,Song of the South,The Street with No Name,Scene of the Crime,The Set-Up,Panic in the Streets,Seven Days to Noon
Th Usul Suspects,,0,15,15,108.6183,0.013909,108.698519,,The Usual Suspects,Prime Suspect: The Lost Child,Prime Suspect 6: The Last Witness,Prime Suspect 7: The Final Act,The Suspect,The Suspect,The Suspect,Prime Suspect: Inner Circles,Prime Suspect 5: Errors of Judgement,Suspect X,Prime Suspect 2,Prime Suspect 3,Suspect,Prime Suspect,Give Us This Day
The Gdfathr: Part II,,0,15,15,116.285558,0.035108,116.370284,,The Godfather: Part II,The Hangover Part II,"The Karate Kid, Part II",The Toxic Avenger Part II,The Last Exorcism Part II,Back to the Future Part II,Hostel: Part II,Gasland Part II,"That's Entertainment, Part II",Father of the Bride Part II,Rambo: First Blood Part II,The Godfather: Part III,The Hangover Part III,Back to the Future Part III,Friday the 13th Part III
Svng Prvate Ryn,,0,15,15,148.996858,0.053668,149.102164,,Ryna,Saving Private Ryan,A Song to Remember,Singin' in the Rain,Torch Song Trilogy,Ayn Rand: A Sense of Life,Ayn Rand: A Sense of Life,Edogawa Ranpo ryèki-kan: Yaneura no sanposha,Song for a Raggy Boy,Rules of Single Life,Private Romeo,Singham Returns,"Bianca come il latte, rossa come il sangue",The Song of Night,The Private Life of Henry VIII.
Bck t the Futre,,0,15,15,106.883237,0.013608,106.952102,,The Tall T,(T)ERROR,T-Rex: Back to the Cretaceous,Dr. T and the Women,Dr. T and the Women,Back to the Future,Back to the Future Part II,Back to the Future Part III,Futurama: The Beast with a Billion Backs,The Man from the Future,The Backwoods,The Backwoods,The Baker,The Future,"Yor, the Hunter from the Future"
Th Trman Shw,,0,15,15,172.930971,0.016592,173.018529,,Shwaas,The Truman Show,The Taming of the Shrew,The Transformers: The Movie,Lady and the Tramp II: Scamp's Adventure,The Sisterhood of the Traveling Pants,The Sisterhood of the Traveling Pants 2,Thanks for Sharing,The Son of the Sheik,The Prisoner of Shark Island,The Trail of the Lonesome Pine,To New Shores,The Adventures of Tom Sawyer,The Shop Around the Corner,The White Ship
Th Scl Ntwrk,,0,15,15,97.544104,0.014711,97.637912,,Scene of the Crime,Salt of the Earth,The Unknown Soldier,The Silent World,The Solid Gold Cadillac,The Horse Soldiers,The Rest Is Silence,The Angry Silence,The Silence,The Silencers,The Scalphunters,The House That Screamed,The School Girls,The Salamander,Scipio the African
